{
  "$schema": "../assignment.schema.json",
  "schemaVersion": "1.0.0",
  "assignmentId": "CDX.DAILY-FACTS.W1",
  "status": "active",
  "dispatchable": true,
  "role": "worker",
  "objective": "Repair the closed-world Codex Workflows findings EXT3-001 through EXT3-008 and KICK1-009 through KICK1-011, then implement and live-dogfood the Founder daily-facts workflow through the real public runner.",
  "completionScope": "vertical-slice",
  "mayReportFeatureComplete": true,
  "feature": "apps/codex-workflows/src/features/daily-facts/FEATURE.md",
  "requiredLayers": {
    "l1": { "status": "required" },
    "l2": { "status": "required" },
    "l3": { "status": "required" }
  },
  "writeSurface": [
    "packages/workflows/src/authoring/api.ts",
    "packages/workflows/src/authoring/authoring.test.ts",
    "packages/workflows/src/authoring/execution.ts",
    "packages/workflows/src/authoring/types.ts",
    "packages/workflows/src/index.ts",
    "packages/workflows/SCHEMA.md",
    "packages/codex/src/runtime/adapter.ts",
    "packages/codex/src/runtime/types.ts",
    "packages/codex/src/runtime/sdk.spec.ts",
    "apps/codex-workflows/src/cli/cli.ts",
    "apps/codex-workflows/src/cli/cli.test.ts",
    "apps/codex-workflows/src/runtime/journal.ts",
    "apps/codex-workflows/src/runtime/journal.test.ts",
    "apps/codex-workflows/src/runtime/local-runner.ts",
    "apps/codex-workflows/src/source/loader.ts",
    "apps/codex-workflows/src/source/typescript.ts",
    "apps/codex-workflows/src/workflows/direct-runner.spec.ts",
    "apps/codex-workflows/src/workflows/model-policy.spec.ts",
    "apps/codex-workflows/src/workflows/support/controlled-source.ts",
    "apps/codex-workflows/src/workflows/support/controlled.workflow.fixture.txt",
    "apps/codex-workflows/src/features/daily-facts/**",
    "apps/codex-workflows/examples/daily-facts.workflow.ts",
    "apps/codex-workflows/project.json",
    "apps/codex-workflows/CLI.md",
    "README.md",
    "packages/testing/src/ground-zero/harness.spec.ts",
    "packages/testing/manifests/codex-workflows.json",
    "packages/testing/manifests/testing.json",
    "packages/testing/evidence/codex-workflows-daily-facts-green-contract.json",
    "packages/testing/evidence/codex-workflows-daily-facts-red.json",
    "packages/testing/evidence/codex-workflows-daily-facts-reproof.json",
    "apps/codex-monitor/project.json",
    "apps/codex-monitor/.gitignore",
    "apps/codex-monitor/src/codex_monitor/__pycache__/**",
    "apps/codex-monitor/tests/__pycache__/**",
    ".agent/testing/workflows/**"
  ],
  "baseRevision": "2b617bcf21aeec0ec14056950efa10af58a910c4",
  "candidateRevision": "working-tree-sha256:3cc59190a29277049c88d9c3e05a7cdd4387a66c205196eabd8ef9e9524b3c4a",
  "stopBoundary": "READY-FOR-AUDIT",
  "greenContract": {
    "id": "CDX-WF-DF-GC-1",
    "strategy": "basic-then-adversarial",
    "redPolicy": "all-new-or-changed-contract-rows",
    "adversarialRequired": true
  },
  "commitAuthority": {
    "allowed": false,
    "maxCommits": 0
  },
  "dependencies": [
    "KICKOFF-AUDIT-1",
    "CDX-WF-GC-2"
  ],
  "evidence": [
    "all-row-meaningful-red-before-product-write",
    "contract-digest-frozen",
    "ordered-l1-l2-l3-green",
    "exact-three-luna-medium-live-research-nodes",
    "exact-public-daily-facts-report",
    "current-news-direct-link-content-proof",
    "affected-and-standing-nx-gates",
    "candidate-bound-machine-results",
    "zero-unexpected-resource-delta",
    "fresh-independent-preflight",
    "fresh-successor-external-audit"
  ]
}
