{
  "$schema": "../assignment.schema.json",
  "schemaVersion": "1.0.0",
  "assignmentId": "CAS-12.R1",
  "status": "ready",
  "dispatchable": false,
  "role": "worker",
  "objective": "For campaign CAS-APP-SERVER-20260901-01, execute canonical Codex desktop local and read-only-remote tool-to-Browser dogfood under lease CAS-12-R1-CODEX-DOGFOOD on gpt-5.6-sol with medium reasoning, then publish BASE_READY evidence without self-acceptance.",
  "completionScope": "vertical-slice",
  "mayReportFeatureComplete": true,
  "feature": "/Users/mcasa_atlantis/.codex/worktrees/a4a6/.codex/docs/goals/codex-app-server/CAS-12-R1-CODEX-DOGFOOD.md",
  "requiredLayers": {
    "l1": {
      "status": "not-applicable",
      "reason": "CAS-12.R1 adds no product logic; deterministic contracts remain owned by accepted predecessor seams."
    },
    "l2": { "status": "required" },
    "l3": { "status": "required" }
  },
  "writeSurface": [
    "apps/codex-control-e2e/features/cas-12-r1/**",
    "apps/codex-control-e2e/src/cas-12-r1/**",
    "packages/testing/evidence/cas-12-r1-*.json",
    ".agent/testing/cas-12-r1/**"
  ],
  "baseRevision": "b9dc01512975a8b11bc673b5ec906c818dd708f6",
  "stopBoundary": "READY-FOR-AUDIT",
  "greenContract": {
    "id": "CAS-12-R1-GC-1",
    "strategy": "basic-then-adversarial",
    "redPolicy": "all-new-or-changed-contract-rows",
    "adversarialRequired": true
  },
  "commitAuthority": { "allowed": false, "maxCommits": 0 },
  "dependencies": [
    "CAS-RP-01:AGENT_RUNTIME_PROFILE_READY",
    "CAS-WA-01:WORKFLOW_AUTHORING_READY",
    "CAS-02:HOST_TRANSPORT_READY",
    "CAS-04:WORKSPACE_READY",
    "CAS-05:MESSAGING_READY",
    "CAS-06:HANDOFF_READY",
    "CAS-07:REMOTE_WORKFLOW_READY",
    "CAS-08:VISIBILITY_PROJECTION_READY",
    "CAS-09.R2:CONTROL_RUNTIME_READY",
    "CAS-10:UI_READY",
    "CAS-11.R2:CODEX_PLUGIN_READY"
  ],
  "evidence": [
    "campaign-id:CAS-APP-SERVER-20260901-01",
    "write-lease:CAS-12-R1-CODEX-DOGFOOD",
    "model:gpt-5.6-sol",
    "reasoning-effort:medium",
    "shared-working-directory:/Users/mcasa_atlantis/.codex/worktrees/a4a6/.codex",
    "activation-gate:exact-CAS-11.R2-CODEX_PLUGIN_READY-evidence",
    "predecessor:CAS-11.R2:sha256:cd25a47dee4742cecab5572c45185ba8f1e38ae45b467ad1b4800d87767daeec",
    "predecessor:CAS-09.R2:sha256:dff03808d46d04ef97c9e4635215e1e46333747173faf0112d8c6d29e3691b95",
    "predecessor:CAS-02:sha256:6d9de03da07248b7a1739a9ee9ea83d532da32c752cb7e3b3ed3a22f1be9e0e8",
    "predecessor:CAS-04:sha256:450f5d97817b06f04aae087fc5a4f21c2a06e1da3bf64eb4bd8fb9db8cd63fe7",
    "predecessor:CAS-05:sha256:6c43f84ca6dfe81ce99fb44e42a95e770da3c3a595d4e7d4a46c69d420ba612b",
    "predecessor:CAS-06:sha256:63ac4d6fd3b3546235af02109e7e8cec6aed831029066d4db768eeb4900fc6d8",
    "predecessor:CAS-07:sha256:43dcec6fb6c4829ca8c69ff490eb2a188680ffc30060a29bf914a34b431e7957",
    "predecessor:CAS-08:sha256:410670137e653ea97746bdacae57104fe1136cc6eafbec4df374a75996096957",
    "predecessor:CAS-10:sha256:d735ea7615de0b7f00e7c90bc5ec3ef5e7a415f3ef5ed0e52e99cc02999c766e",
    "fresh-repo-marketplace-codex-task",
    "one-control-tool-call-then-one-in-app-browser-call",
    "local-and-remote-read-only-delegation-and-two-phase-workflow",
    "selected-agent-only-detail-and-aborted-late-result-rejection",
    "restart-retry-reconnect-no-duplicate-agent-workflow-message-completion-or-tab",
    "chatgpt-work-developer-mode-and-secure-mcp-tunnel-excluded",
    "BASE_READY-is-not-audit-acceptance",
    "no-audit-commit-merge-push-publish-or-deploy"
  ]
}
